"symbol","name","industry","subsector","group","latest","start","latestDate","startDate","diffToMin","diffToMax","diff","min","minDate","median","average","max","maxDate","low","numberOfDates"
"SAM","Công ty Cổ phần SAM Holdings","Công nghệ Thông tin","Thiết bị viễn thông","HOSE",11.4,11.8,"2021-03-05","2021-02-05",11.4,0.5,11.9,0,"2021-02-15",11.48,10.24,11.9,"2021-02-17",false,18
"SAV","Công ty Cổ phần Hợp tác Kinh tế và Xuất nhập khẩu Savimex","Công nghiệp","Vật liệu xây dựng & Nội thất","HOSE",28.7,20,"2021-03-05","2021-02-05",28.7,1.15,29.85,0,"2021-02-15",22.45,21.75,29.85,"2021-03-02",false,18
"SBA","Công ty Cổ phần Sông Ba","Tiện ích Cộng đồng","Sản xuất & Phân phối Điện","HOSE",15.9,15.8,"2021-03-05","2021-02-05",15.9,0.2,16.1,0,"2021-02-15",15.93,14.15,16.1,"2021-02-25",false,18
"SBT","Công ty Cổ phần Thành Thành Công - Biên Hòa","Hàng Tiêu dùng","Thực phẩm","VN30",22.45,20.5,"2021-03-05","2021-02-05",22.45,0.9,23.35,0,"2021-02-15",22.4,19.81,23.35,"2021-02-17",false,18
"SBV","Công ty Cổ phần Siam Brothers Việt Nam","Dịch vụ Tiêu dùng","Phân phối hàng chuyên dụng","HOSE",12.7,12.75,"2021-03-05","2021-02-05",12.7,0.3,13,0,"2021-02-15",12.72,11.32,13,"2021-03-01",false,18
"SC5","Công ty Cổ phần Xây dựng số 5","Công nghiệp","Xây dựng","HOSE",21.15,23.25,"2021-03-04","2021-02-17",1.3,2.1,3.4,19.85,"2021-02-25",21.07,21.23,23.25,"2021-02-17",true,10
"SCD","Công ty Cổ phần Nước giải khát Chương Dương","Hàng Tiêu dùng","Đồ uống & giải khát","HOSE",24.1,24.2,"2021-03-04","2021-02-05",24.1,0.9,25,0,"2021-02-15",24,20.81,25,"2021-02-17",false,15
"SCI","Công ty Cổ phần SCI E&C","Công nghiệp","Xây dựng","HNX",60.3,52.2,"2021-03-05","2021-02-05",8.1,6.2,14.3,52.2,"2021-02-05",58.5,58.14,66.5,"2021-03-03",false,18
"SCR","Công ty Cổ phần Địa Ốc Sài Gòn Thương Tín","Tài chính","Bất động sản","HOSE",9.01,8.3,"2021-03-05","2021-02-05",9.01,0,9.01,0,"2021-02-15",8.3,7.49,9.01,"2021-03-05",false,18
"SCS","Công ty Cổ phần Dịch vụ Hàng hóa Sài Gòn","Dịch vụ Tiêu dùng","Hàng không","HOSE",136,130,"2021-03-05","2021-02-05",136,1,137,0,"2021-02-15",130,116.84,137,"2021-03-03",false,18
"SD2","Công ty Cổ phần Sông Đà 2","Công nghiệp","Xây dựng","HNX",5.9,5.4,"2021-03-05","2021-02-05",0.6,0.1,0.7,5.3,"2021-02-23",5.75,5.71,6,"2021-03-03",false,18
"SD4","Công ty Cổ phần Sông Đà 4","Công nghiệp","Xây dựng","HNX",4.5,3.8,"2021-03-05","2021-02-05",0.7,0,0.7,3.8,"2021-02-05",4.1,4.11,4.5,"2021-03-05",false,16
"SD5","Công ty Cổ phần Sông Đà 5","Công nghiệp","Xây dựng","HNX",8.6,7.7,"2021-03-05","2021-02-05",1.2,0,1.2,7.4,"2021-02-08",7.9,7.93,8.6,"2021-03-05",false,18
"SD6","Công ty Cổ phần Sông Đà 6","Công nghiệp","Xây dựng","HNX",4.3,3.4,"2021-03-05","2021-02-05",1,0,1,3.3,"2021-02-08",3.6,3.66,4.3,"2021-03-05",false,18
"SD9","Công ty Cổ phần Sông Đà 9","Công nghiệp","Xây dựng","HNX",7.9,7.1,"2021-03-05","2021-02-05",1.3,0,1.3,6.6,"2021-02-09",7.1,7.06,7.9,"2021-03-05",false,18
"SDA","Công ty Cổ phần SIMCO Sông Đà","Công nghiệp","Đào tạo & Việc làm","HNX",4.2,4.3,"2021-03-05","2021-02-05",0,0.5,0.5,4.2,"2021-03-04",4.5,4.45,4.7,"2021-02-17",true,8
"SDG","Công ty Cổ phần Sadico Cần Thơ","Công nghiệp","Containers & Đóng gói","HNX",45.1,43.4,"2021-03-02","2021-02-05",4.1,0,4.1,41,"2021-02-26",45,44.08,45.1,"2021-03-02",false,9
"SDN","Công ty Cổ phần Sơn Đồng Nai","Công nghiệp","Vật liệu xây dựng & Nội thất","HNX",34,30.5,"2021-03-04","2021-02-09",3.5,0,3.5,30.5,"2021-02-09",32,31.81,34,"2021-03-04",false,9
"SDT","Công ty Cổ phần Sông Đà 10","Công nghiệp","Xây dựng","HNX",6.2,5.5,"2021-03-05","2021-02-05",1.2,0,1.2,5,"2021-02-08",5.5,5.51,6.2,"2021-03-05",false,18
"SDU","Công ty Cổ phần Đầu tư Xây dựng và Phát triển Đô thị Sông Đà","Công nghiệp","Xây dựng","HNX",6.8,6.7,"2021-03-03","2021-02-26",0.1,0,0.1,6.7,"2021-02-26",6.75,6.75,6.8,"2021-03-03",false,2
"SEB","Công ty Cổ phần Đầu tư và Phát triển Điện Miền Trung","Tiện ích Cộng đồng","Sản xuất & Phân phối Điện","HNX",50,42,"2021-02-24","2021-02-18",8,0,8,42,"2021-02-18",45.5,45.75,50,"2021-02-24",false,4
"SED","Công ty Cổ phần Đầu tư và Phát triển Giáo dục Phương Nam","Dịch vụ Tiêu dùng","Sách, ấn bản & sản phẩm văn hóa","HNX",18.3,17,"2021-03-05","2021-02-05",1.6,0.6,2.2,16.7,"2021-02-08",17.3,17.49,18.9,"2021-03-03",false,18
"SFC","Công ty Cổ phần Nhiên liệu Sài Gòn","Tiện ích Cộng đồng","Phân phối xăng dầu & khí đốt","HOSE",24.5,23,"2021-03-04","2021-02-05",1.5,0,1.5,23,"2021-02-05",23.3,23.34,24.5,"2021-03-04",false,7
"SFG","Công ty Cổ phần Phân bón Miền Nam","Nguyên vật liệu","Sản phẩm hóa dầu, Nông dược & Hóa chất khác","HOSE",10.3,7.66,"2021-03-05","2021-02-05",10.3,0,10.3,0,"2021-02-15",8.07,7.55,10.3,"2021-03-05",false,18
"SFI","Công ty Cổ phần Đại lý Vận tải Safi","Công nghiệp","Vận tải Thủy","HOSE",39.7,35.8,"2021-03-05","2021-02-05",39.7,2.3,42,0,"2021-02-15",39.6,34.56,42,"2021-03-03",false,18
"SFN","Công ty Cổ phần Dệt lưới Sài Gòn","Công nghiệp","Nhà cung cấp thiết bị","HNX",22.2,21.4,"2021-02-26","2021-02-05",2.09,0.33,2.42,20.11,"2021-02-18",21.38,21.32,22.53,"2021-02-23",false,8
"SGC","Công ty Cổ phần Xuất nhập khẩu Sa Giang","Hàng Tiêu dùng","Thực phẩm","HNX",92,90,"2021-03-05","2021-02-19",2,0,2,90,"2021-02-19",90,90.67,92,"2021-03-05",false,3
"SGD","Công ty Cổ phần Sách Giáo dục tại TP.HCM","Dịch vụ Tiêu dùng","Sách, ấn bản & sản phẩm văn hóa","HNX",10,9,"2021-03-05","2021-02-05",1,0,1,9,"2021-02-05",9.45,9.43,10,"2021-03-05",false,10
"SGH","Công ty Cổ phần Khách sạn Sài Gòn","Dịch vụ Tiêu dùng","Khách sạn","HNX",40.9,40.9,"2021-02-22","2021-02-22",0,0,0,40.9,"2021-02-22",40.9,40.9,40.9,"2021-02-22",false,1
"SGN","Công ty Cổ phần Phục vụ mặt đất Sài Gòn","Công nghiệp","Kho bãi, hậu cần và bảo dưỡng","HOSE",70,68.5,"2021-03-05","2021-02-05",70,0,70,0,"2021-02-15",69,61.48,70,"2021-03-02",false,18
"SGR","Công ty Cổ phần Địa ốc Sài Gòn","Tài chính","Bất động sản","HOSE",25.3,19.4,"2021-03-05","2021-02-05",25.3,0.8,26.1,0,"2021-02-15",24.7,21.08,26.1,"2021-03-02",false,18
"SGT","Công ty Cổ phần Công nghệ Viễn thông Sài Gòn","Công nghệ Thông tin","Internet","HOSE",15.4,14.3,"2021-03-05","2021-02-05",15.4,1.5,16.9,0,"2021-02-15",15.38,13.63,16.9,"2021-02-23",false,18
"SHA","Công ty Cổ phần Sơn Hà Sài Gòn","Nguyên vật liệu","Thép và sản phẩm thép","HOSE",5.1,4.73,"2021-03-05","2021-02-05",5.1,0,5.1,0,"2021-02-15",4.87,4.32,5.1,"2021-02-23",false,18
"SHB","Ngân hàng Thương mại Cổ phần Sài Gòn – Hà Nội","Ngân hàng","Ngân hàng","HNX30",15.8,16.1,"2021-03-05","2021-02-05",0.7,0.5,1.2,15.1,"2021-02-08",15.9,15.85,16.3,"2021-02-23",true,18
"SHE","Công ty Cổ phần Phát triển Năng Lượng Sơn Hà","Hàng Tiêu dùng","Đồ gia dụng lâu bền","HNX",19,18.3,"2021-03-05","2021-02-05",0.7,0.8,1.5,18.3,"2021-02-05",18.89,18.98,19.8,"2021-02-15",false,18
"SHI","Công ty Cổ phần Quốc tế Sơn Hà","Nguyên vật liệu","Thép và sản phẩm thép","HOSE",13.3,9.8,"2021-03-05","2021-02-05",13.3,0,13.3,0,"2021-02-15",11.05,9.67,13.3,"2021-03-05",false,18
"SHN","Công ty Cổ phần Đầu tư Tổng hợp Hà Nội","Công nghiệp","Xây dựng","HNX",9.5,9,"2021-03-05","2021-02-05",1.3,0,1.3,8.2,"2021-02-08",8.8,8.82,9.5,"2021-03-05",false,18
"SHP","Công ty Cổ phần Thủy điện Miền Nam","Tiện ích Cộng đồng","Sản xuất & Phân phối Điện","HOSE",22.2,22.5,"2021-03-05","2021-02-05",22.2,1.45,23.65,0,"2021-02-15",22.3,19.8,23.65,"2021-02-09",false,17
"SHS","Công ty Cổ phần Chứng khoán Sài Gòn - Hà Nội","Tài chính","Môi giới chứng khoán","HNX30",27.5,25.3,"2021-03-05","2021-02-05",3.5,0.5,4,24,"2021-02-08",26.1,26.31,28,"2021-03-01",false,18
"SIC","Công ty Cổ phần ANI","Công nghiệp","Xây dựng","HNX",14.3,13.6,"2021-03-04","2021-02-09",1.2,0.1,1.3,13.1,"2021-03-01",14,13.88,14.4,"2021-03-02",false,11
"SII","Công ty Cổ phần Hạ tầng Nước Sài Gòn","Công nghiệp","Xây dựng","HOSE",18.25,18,"2021-02-26","2021-02-09",18.25,0,18.25,0,"2021-02-15",17.5,13.28,18.25,"2021-02-26",false,8
"SJ1","Công ty Cổ phần Nông nghiệp Hùng Hậu","Hàng Tiêu dùng","Nuôi trồng nông & hải sản","HNX",17.5,17.9,"2021-03-05","2021-02-08",1.5,0.4,1.9,16,"2021-03-02",17.05,17.01,17.9,"2021-02-08",false,8
"SJD","Công ty Cổ phần Thủy điện Cần Đơn","Tiện ích Cộng đồng","Sản xuất & Phân phối Điện","HOSE",17.25,17,"2021-03-05","2021-02-05",17.25,0.05,17.3,0,"2021-02-15",17.1,15.2,17.3,"2021-03-03",false,18
"SJE","Công ty Cổ phần Sông Đà 11","Công nghiệp","Xây dựng","HNX30",17.1,17.9,"2021-03-05","2021-02-05",0.1,1.2,1.3,17,"2021-03-01",17.9,17.7,18.3,"2021-02-09",true,15
"SJF","Công ty Cổ phần Đầu tư Sao Thái Dương","Dược phẩm và Y tế","Công nghệ sinh học","HOSE",2.77,2.44,"2021-03-05","2021-02-05",2.77,0.03,2.8,0,"2021-02-15",2.53,2.27,2.8,"2021-03-04",false,18
"SJS","Công ty Cổ phần Đầu tư Phát triển Đô thị và Khu công nghiệp Sông Đà","Tài chính","Bất động sản","HOSE",39,35.8,"2021-03-05","2021-02-05",39,3.45,42.45,0,"2021-02-15",39.45,35.15,42.45,"2021-02-19",false,18
"SKG","Công ty Cổ phần Tàu Cao tốc Superdong - Kiên Giang","Dịch vụ Tiêu dùng","Vận tải hành khách & Du lịch","HOSE",11.3,10.8,"2021-03-05","2021-02-05",11.3,0.25,11.55,0,"2021-02-15",11.22,9.89,11.55,"2021-02-22",false,18
"SLS","Công ty Cổ phần Mía đường Sơn La","Hàng Tiêu dùng","Thực phẩm","HNX30",106.8,89,"2021-03-05","2021-02-05",17.8,1.6,19.4,89,"2021-02-05",106.95,101.28,108.4,"2021-03-01",false,18
"SMA","Công ty Cổ phần Thiết bị Phụ tùng Sài Gòn","Công nghiệp","Nhà cung cấp thiết bị","HOSE",8.4,7.5,"2021-03-05","2021-02-05",8.4,0.58,8.98,0,"2021-02-15",8.38,7.46,8.98,"2021-02-18",false,18
"SMB","Công ty Cổ phần Bia Sài Gòn - Miền Trung","Hàng Tiêu dùng","Sản xuất bia ","HOSE",43.5,43.6,"2021-03-05","2021-02-05",43.5,1.9,45.4,0,"2021-02-15",43.7,38.89,45.4,"2021-02-09",false,18
"SMC","Công ty Cổ phần Đầu tư Thương mại SMC","Nguyên vật liệu","Thép và sản phẩm thép","HOSE",26.55,21.8,"2021-03-05","2021-02-05",26.55,0.35,26.9,0,"2021-02-15",23,21.38,26.9,"2021-03-03",false,18
"SMN","Công ty Cổ phần Sách và thiết bị giáo dục Miền Nam","Dịch vụ Tiêu dùng","Sách, ấn bản & sản phẩm văn hóa","HNX",10.3,10,"2021-03-05","2021-02-05",0.4,0.4,0.8,9.9,"2021-02-19",10.2,10.2,10.7,"2021-02-23",false,13
"SMT","Công ty Cổ phần SAMETEL","Công nghệ Thông tin","Thiết bị viễn thông","HNX",10.3,9.9,"2021-03-05","2021-02-05",1.2,0,1.2,9.1,"2021-02-17",9.4,9.54,10.3,"2021-03-05",false,12
"SPI","Công ty Cổ phần SPI","Nguyên vật liệu","Khai khoáng ","HNX",7.9,2.8,"2021-03-05","2021-02-05",5.3,0,5.3,2.6,"2021-02-08",4.05,4.4,7.9,"2021-03-05",false,18
"SPM","Công ty Cổ phần S.P.M","Dược phẩm và Y tế","Dược phẩm","HOSE",13,12,"2021-03-04","2021-02-05",13,0.3,13.3,0,"2021-02-15",12.5,10.82,13.3,"2021-03-01",false,14
"SRA","Công ty Cổ phần SARA Việt Nam","Công nghệ Thông tin","Phần mềm","HNX",9.2,8.7,"2021-03-05","2021-02-05",0.6,0.1,0.7,8.6,"2021-02-08",9,8.99,9.3,"2021-02-23",false,18
"SRC","Công ty Cổ phần Cao su Sao Vàng","Hàng Tiêu dùng","Lốp xe","HOSE",21.7,21.25,"2021-03-05","2021-02-05",21.7,0.9,22.6,0,"2021-02-15",21.23,19.05,22.6,"2021-02-25",false,18
"SRF","Công ty Cổ phần Kỹ nghệ lạnh","Công nghiệp","Máy công nghiệp","HOSE",13,13.7,"2021-03-05","2021-02-05",13,1.3,14.3,0,"2021-02-15",13.7,11.8,14.3,"2021-02-09",false,15
"SSC","Công ty Cổ phần Giống cây trồng Miền Nam","Hàng Tiêu dùng","Nuôi trồng nông & hải sản","HOSE",45.95,46.45,"2021-03-05","2021-02-05",45.95,0.9,46.85,0,"2021-02-15",45.8,37.51,46.85,"2021-03-01",false,11
"SSI","Công ty Cổ phần Chứng khoán SSI","Tài chính","Môi giới chứng khoán","VN30",33.45,31.5,"2021-03-05","2021-02-05",33.45,1.6,35.05,0,"2021-02-15",33.38,29.57,35.05,"2021-03-02",false,18
"SSM","Công ty Cổ phần Chế tạo kết cấu thép VNECO.SSM","Nguyên vật liệu","Thép và sản phẩm thép","HNX",7.5,5.4,"2021-03-05","2021-02-08",2.1,0.3,2.4,5.4,"2021-02-08",5.8,6.41,7.8,"2021-03-03",false,13
"ST8","Công ty Cổ phần Siêu Thanh","Công nghệ Thông tin","Thiết bị văn phòng","HOSE",11.1,11.3,"2021-03-05","2021-02-05",11.1,0.3,11.4,0,"2021-02-15",11.15,9.6,11.4,"2021-02-09",false,14
"STB","Ngân hàng Thương mại Cổ phần Sài Gòn Thương Tín","Ngân hàng","Ngân hàng","VN30",18.7,18.3,"2021-03-05","2021-02-05",18.7,0.45,19.15,0,"2021-02-15",18.55,16.49,19.15,"2021-03-02",false,18
"STC","Công ty Cổ phần Sách và Thiết bị trường học Tp. Hồ Chí Minh","Dịch vụ Tiêu dùng","Sách, ấn bản & sản phẩm văn hóa","HNX",16,16.8,"2021-03-05","2021-02-08",0.9,1.2,2.1,15.1,"2021-02-18",16,16.15,17.2,"2021-02-23",true,15
"STG","Công ty Cổ phần Kho Vận Miền Nam","Công nghiệp","Kho bãi, hậu cần và bảo dưỡng","HOSE",15.5,15.1,"2021-03-05","2021-02-05",15.5,0.3,15.8,0,"2021-02-15",15.5,13.61,15.8,"2021-02-23",false,18
"STK","Công ty Cổ phần Sợi Thế Kỷ","Hàng Tiêu dùng","Hàng May mặc","HOSE",31.35,26.2,"2021-03-05","2021-02-05",31.35,0,31.35,0,"2021-02-15",26.65,24.01,31.35,"2021-03-05",false,18
"STP","Công ty Cổ phần Công nghiệp Thương mại Sông Đà","Công nghiệp","Containers & Đóng gói","HNX",8.4,7.8,"2021-03-05","2021-02-08",1,0,1,7.4,"2021-02-24",8,7.88,8.4,"2021-03-05",false,13
"SVC","Công ty Cổ phần Dịch vụ tổng hợp Sài Gòn","Hàng Tiêu dùng","Sản xuất ô tô","HOSE",70,74,"2021-03-04","2021-02-23",0,4,4,70,"2021-03-01",70,71,74,"2021-02-23",true,4
"SVI","Công ty Cổ phần Bao bì Biên Hòa","Công nghiệp","Containers & Đóng gói","HOSE",84.5,84,"2021-03-05","2021-02-05",1.5,5.3,6.8,83,"2021-02-24",85,85.93,89.8,"2021-03-02",true,12
"SVN","Công ty Cổ phần Tập đoàn Vexilla Việt Nam","Công nghiệp","Xây dựng","HNX",4.6,2.3,"2021-03-05","2021-02-05",2.3,0,2.3,2.3,"2021-02-05",2.6,2.95,4.6,"2021-03-05",false,18
"SVT","Công ty Cổ phần Công nghệ Sài Gòn Viễn Đông","Nguyên vật liệu","Sản xuất giấy","HOSE",14.2,15.65,"2021-03-05","2021-02-05",14.2,1.45,15.65,0,"2021-02-15",14.1,12.69,15.65,"2021-02-05",false,18
"SZB","Công ty Cổ phần Sonadezi Long Bình","Tài chính","Bất động sản","HNX",34.2,34.2,"2021-03-05","2021-02-05",0.2,0.3,0.5,34,"2021-02-26",34.4,34.34,34.5,"2021-02-22",true,18
"SZC","Công ty Cổ phần Sonadezi Châu Đức","Tài chính","Bất động sản","HOSE",41.6,37.9,"2021-03-05","2021-02-05",41.6,1.8,43.4,0,"2021-02-15",39.97,35.8,43.4,"2021-03-03",false,18
"SZL","Công ty Cổ phần Sonadezi Long Thành","Tài chính","Bất động sản","HOSE",54.3,52.2,"2021-03-05","2021-02-05",54.3,0.6,54.9,0,"2021-02-15",54.1,47.83,54.9,"2021-03-02",false,18
"TA9","Công ty Cổ phần Xây lắp Thành An 96","Công nghiệp","Xây dựng","HNX",12.2,10.8,"2021-03-05","2021-02-05",1.7,0.3,2,10.5,"2021-02-08",11.5,11.56,12.5,"2021-03-03",false,18
"TAC","Công ty Cổ phần Dầu Thực vật Tường An","Hàng Tiêu dùng","Thực phẩm","HOSE",50,47.9,"2021-03-05","2021-02-05",50,1.5,51.5,0,"2021-02-15",47.95,43.09,51.5,"2021-03-02",false,18
"TAR","Công ty Cổ phần Nông nghiệp Công nghệ cao Trung An","Hàng Tiêu dùng","Nuôi trồng nông & hải sản","HNX",23.4,19.7,"2021-03-05","2021-02-05",4,0.1,4.1,19.4,"2021-02-08",22.45,21.89,23.5,"2021-03-03",false,18
"TBC","Công ty Cổ phần Thủy điện Thác Bà","Tiện ích Cộng đồng","Sản xuất & Phân phối Điện","HOSE",24.9,25.35,"2021-03-05","2021-02-05",24.9,0.45,25.35,0,"2021-02-15",25,22.2,25.35,"2021-02-05",false,18
"TC6","Công ty Cổ phần Than Cọc Sáu - Vinacomin","Nguyên vật liệu","Khai thác Than","HNX",4.6,4.7,"2021-03-05","2021-02-05",0.1,0.1,0.2,4.5,"2021-02-09",4.6,4.59,4.7,"2021-02-05",false,18
"TCB","Ngân hàng Thương mại Cổ phần Kỹ thương Việt Nam","Ngân hàng","Ngân hàng","VN30",39.2,36.3,"2021-03-05","2021-02-05",39.2,1.15,40.35,0,"2021-02-15",38.97,34.35,40.35,"2021-03-03",false,18
"TCD","Công ty Cổ phần Đầu tư Phát triển Công nghiệp và Vận tải","Công nghiệp","Xây dựng","HOSE",15.7,13,"2021-03-05","2021-02-05",15.7,1.8,17.5,0,"2021-02-15",13.38,12.99,17.5,"2021-03-01",false,18
"TCH","Công ty Cổ phần Đầu tư Dịch vụ Tài chính Hoàng Huy","Hàng Tiêu dùng","Sản xuất ô tô","VN30",21.95,22.55,"2021-03-05","2021-02-05",21.95,1.55,23.5,0,"2021-02-15",22.2,19.85,23.5,"2021-02-18",false,18
"TCL","Công ty Cổ phần Đại lý Giao nhận Vận tải Xếp dỡ Tân Cảng","Công nghiệp","Dịch vụ vận tải","HOSE",29.75,28.35,"2021-03-05","2021-02-05",29.75,0.25,30,0,"2021-02-15",28.92,25.86,30,"2021-03-03",false,18
"TCM","Công ty Cổ phần Dệt may - Đầu tư - Thương mại Thành Công","Hàng Tiêu dùng","Hàng May mặc","HOSE",81.5,75.9,"2021-03-05","2021-02-05",81.5,0,81.5,0,"2021-02-15",77.65,69.23,81.5,"2021-03-05",false,18
"TCO","Công ty Cổ phần Vận tải Đa phương thức Duyên Hải","Công nghiệp","Dịch vụ vận tải","HOSE",10.7,10,"2021-03-04","2021-02-22",0.7,0,0.7,10,"2021-02-22",10.7,10.56,10.7,"2021-02-23",false,5
"TCR","Công ty Cổ phần Công nghiệp Gốm sứ TAICERA","Công nghiệp","Vật liệu xây dựng & Nội thất","HOSE",4.01,4.25,"2021-03-05","2021-02-05",4.01,0.24,4.25,0,"2021-02-15",4,3.62,4.25,"2021-02-05",false,18
"TCT","Công ty Cổ phần Cáp treo Núi Bà Tây Ninh","Dịch vụ Tiêu dùng","Vận tải hành khách & Du lịch","HOSE",32.45,29.4,"2021-03-05","2021-02-05",32.45,0,32.45,0,"2021-02-15",29.35,26.3,32.45,"2021-03-05",false,18
"TDC","Công ty Cổ phần Kinh doanh và Phát triển Bình Dương","Công nghiệp","Vật liệu xây dựng & Nội thất","HOSE",22.5,17.2,"2021-03-05","2021-02-05",22.5,0.65,23.15,0,"2021-02-15",17.52,17.01,23.15,"2021-03-03",false,18
"TDG","Công ty Cổ phần Dầu khí Thái Dương","Tiện ích Cộng đồng","Phân phối xăng dầu & khí đốt","HOSE",3.32,3.33,"2021-03-05","2021-02-05",3.32,0.13,3.45,0,"2021-02-15",3.32,2.95,3.45,"2021-02-17",false,18
"TDH","Công ty Cổ phần Phát triển Nhà Thủ Đức","Tài chính","Bất động sản","HOSE",7.55,7.43,"2021-03-05","2021-02-05",7.55,0.92,8.47,0,"2021-02-15",7.61,6.89,8.47,"2021-02-19",false,18
"TDM","Công ty Cổ phần Nước Thủ Dầu Một","Tiện ích Cộng đồng","Nước","HOSE",28.4,26.4,"2021-03-05","2021-02-05",28.4,1.05,29.45,0,"2021-02-15",28,24.67,29.45,"2021-03-03",false,18
"TDN","Công ty Cổ phần Than Đèo Nai - Vinacomin","Nguyên vật liệu","Khai thác Than","HNX",8,7.3,"2021-03-05","2021-02-05",0.7,0,0.7,7.3,"2021-02-05",7.6,7.59,8,"2021-03-05",false,18
"TDP","Công ty Cổ phần Thuận Đức","Công nghiệp","Containers & Đóng gói","HOSE",26,25.3,"2021-03-05","2021-02-05",26,1.2,27.2,0,"2021-02-15",25.5,22.81,27.2,"2021-02-19",false,18
"TDT","Công ty Cổ phần Đầu tư và Phát triển TDT","Hàng Tiêu dùng","Hàng May mặc","HNX",13.8,10.3,"2021-03-05","2021-02-05",4.2,0.1,4.3,9.6,"2021-02-08",12.8,12.02,13.9,"2021-03-03",false,18
"TDW","Công ty Cổ phần Cấp nước Thủ Đức","Tiện ích Cộng đồng","Nước","HOSE",35.7,30,"2021-03-05","2021-02-08",5.7,0,5.7,30,"2021-02-08",34.05,33.14,35.7,"2021-03-05",false,7
"TEG","Công ty Cổ phần Năng Lượng và Bất động sản Trường Thành","Tài chính","Bất động sản","HOSE",9.5,7.8,"2021-03-05","2021-02-05",9.5,0.3,9.8,0,"2021-02-15",8.4,7.68,9.8,"2021-03-03",false,18
"TFC","Công ty Cổ phần Trang","Hàng Tiêu dùng","Thực phẩm","HNX",7.2,6.5,"2021-03-05","2021-02-05",1.2,0,1.2,6,"2021-02-19",6.3,6.37,7.2,"2021-03-05",false,18
"TGG","Công ty Cổ phần Đầu tư và Xây dựng Trường Giang","Công nghiệp","Xây dựng","HOSE",2.04,2.04,"2021-03-05","2021-02-05",2.04,0,2.04,0,"2021-02-15",1.9,1.71,2.04,"2021-02-05",false,18
"THB","Công ty Cổ phần Bia Hà Nội - Thanh Hóa","Hàng Tiêu dùng","Sản xuất bia ","HNX",9.8,9.5,"2021-03-05","2021-02-05",0.8,0,0.8,9,"2021-02-24",9.5,9.47,9.8,"2021-03-05",false,14
"THD","Công ty Cổ phần Thaiholdings","Tài chính","Bất động sản","HNX",203.9,160,"2021-03-05","2021-02-05",43.9,0,43.9,160,"2021-02-05",178.1,181.31,203.9,"2021-03-05",false,18
"THG","Công ty Cổ phần Đầu tư và Xây dựng Tiền Giang","Công nghiệp","Xây dựng","HOSE",73,62.8,"2021-03-05","2021-02-05",73,1.7,74.7,0,"2021-02-15",67.45,61.29,74.7,"2021-03-02",false,18
"THI","Công ty Cổ phần Thiết bị điện","Công nghiệp","Thiết bị điện","HOSE",27,27.5,"2021-03-05","2021-02-05",27,1.5,28.5,0,"2021-02-15",27.5,23.7,28.5,"2021-03-03",false,14
"THT","Công ty Cổ phần Than Hà Tu - Vinacomin","Nguyên vật liệu","Khai thác Than","HNX",8.3,7.5,"2021-03-05","2021-02-05",0.9,0,0.9,7.4,"2021-02-08",7.9,7.85,8.3,"2021-03-05",false,18
"TIG","Công ty Cổ phần Tập đoàn Đầu tư Thăng Long","Tài chính","Bất động sản","HNX",9.3,6.9,"2021-03-05","2021-02-05",2.4,0,2.4,6.9,"2021-02-05",7.95,8.04,9.3,"2021-03-05",false,18
"TIP","Công ty Cổ phần Phát triển Khu công nghiệp Tín Nghĩa","Tài chính","Bất động sản","HOSE",49.25,51,"2021-03-05","2021-02-05",49.25,1.75,51,0,"2021-02-15",49.53,44.02,51,"2021-02-05",false,18
"TIX","Công ty Cổ phần Sản xuất Kinh doanh Xuất nhập khẩu Dịch vụ và Đầu tư Tân Bình","Tài chính","Bất động sản","HOSE",28.1,32.85,"2021-03-04","2021-02-26",0.8,4.75,5.55,27.3,"2021-03-03",28.5,29.47,32.85,"2021-02-26",true,5
"TJC","Công ty Cổ phần Dịch vụ Vận tải và Thương mại","Công nghiệp","Dịch vụ vận tải","HNX",10.9,11.5,"2021-03-04","2021-02-05",0.2,0.8,1,10.7,"2021-02-08",10.8,10.93,11.7,"2021-02-18",true,11
"TKC","Công ty Cổ phần Xây dựng và Kinh doanh Địa ốc Tân Kỷ","Công nghiệp","Xây dựng","HNX",7.4,6.9,"2021-03-03","2021-02-05",0.6,0.1,0.7,6.8,"2021-02-25",7.25,7.22,7.5,"2021-02-09",false,14
"TKU","Công ty Cổ phần Công nghiệp Tung Kuang","Nguyên vật liệu","Nhôm","HNX",13.5,15.5,"2021-03-04","2021-02-05",1.2,2,3.2,12.3,"2021-02-24",14.3,14.13,15.5,"2021-02-05",true,12
"TLD","Công ty Cổ phần Đầu tư Xây dựng và Phát triển Đô thị Thăng Long","Tài chính","Bất động sản","HOSE",6.02,5.61,"2021-03-05","2021-02-05",6.02,0.02,6.04,0,"2021-02-15",5.8,5.15,6.04,"2021-03-03",false,18
"TLG","Công ty Cổ phần Tập đoàn Thiên Long","Hàng Tiêu dùng","Đồ gia dụng một lần","HOSE",39.2,39.35,"2021-03-05","2021-02-05",39.2,1.8,41,0,"2021-02-15",39.1,35,41,"2021-02-09",false,18
"TLH","Công ty Cổ phần Tập đoàn Thép Tiến Lên","Nguyên vật liệu","Thép và sản phẩm thép","HOSE",11.8,6.87,"2021-03-05","2021-02-05",11.8,0,11.8,0,"2021-02-15",7.19,7.38,11.8,"2021-03-05",false,18
"TMB","Công ty Cổ phần Kinh doanh Than Miền Bắc - Vinacomin","Nguyên vật liệu","Khai thác Than","HNX",14.4,16.4,"2021-03-05","2021-02-05",0.4,2.2,2.6,14,"2021-03-03",14.6,14.85,16.6,"2021-02-08",true,13
"TMC","Công ty Cổ phần Thương mại Xuất nhập khẩu Thủ Đức","Tiện ích Cộng đồng","Phân phối xăng dầu & khí đốt","HNX",12.2,13.5,"2021-03-05","2021-02-09",2,1.3,3.3,10.2,"2021-02-22",12.1,12.03,13.5,"2021-02-09",false,15
"TMP","Công ty Cổ phần Thủy điện Thác Mơ","Tiện ích Cộng đồng","Sản xuất & Phân phối Điện","HOSE",42,39.5,"2021-03-05","2021-02-05",42,0.05,42.05,0,"2021-02-15",41.65,36.52,42.05,"2021-02-24",false,18
"TMS","Công ty Cổ phần Transimex","Công nghiệp","Kho bãi, hậu cần và bảo dưỡng","HOSE",42.6,40.5,"2021-03-05","2021-02-05",42.6,0.3,42.9,0,"2021-02-15",38.9,35.36,42.9,"2021-03-04",false,18
"TMT","Công ty Cổ phần Ô tô TMT","Hàng Tiêu dùng","Sản xuất ô tô","HOSE",6.44,5.4,"2021-03-05","2021-02-05",6.44,0,6.44,0,"2021-02-15",5.65,5.1,6.44,"2021-03-05",false,18
"TMX","Công ty Cổ phần VICEM Thương mại Xi măng","Công nghiệp","Vật liệu xây dựng & Nội thất","HNX",17.5,17.5,"2021-02-08","2021-02-08",0,0,0,17.5,"2021-02-08",17.5,17.5,17.5,"2021-02-08",false,1
"TN1","Công ty Cổ phần Thương mại Dịch vụ TNS Holdings","Tài chính","Bất động sản","HOSE",62,67,"2021-03-05","2021-02-05",62,5,67,0,"2021-02-15",64.25,57.37,67,"2021-02-05",false,18
"TNA","Công ty Cổ phần Thương mại Xuất nhập khẩu Thiên Nam","Hàng Tiêu dùng","Thực phẩm","HOSE",12.65,12.15,"2021-03-05","2021-02-05",12.65,0.25,12.9,0,"2021-02-15",12.47,11.11,12.9,"2021-02-22",false,18
"TNC","Công ty Cổ phần Cao su Thống Nhất","Nguyên vật liệu","Nhựa, cao su & sợi","HOSE",27.3,29.8,"2021-03-05","2021-02-09",27.3,2.5,29.8,0,"2021-02-15",27.65,21.38,29.8,"2021-02-09",false,8
"TNG","Công ty Cổ phần Đầu tư và Thương mại TNG","Hàng Tiêu dùng","Hàng May mặc","HNX30",25,21.2,"2021-03-05","2021-02-05",5.5,0,5.5,19.5,"2021-02-08",21.9,22.38,25,"2021-03-03",false,18
