"symbol","name","industry","subsector","group","latest","start","latestDate","startDate","diffToMin","diffToMax","diff","min","minDate","median","average","max","maxDate","low","numberOfDates"
"DAE","Công ty Cổ phần Sách Giáo dục tại TP.Đà Nẵng","Dịch vụ Tiêu dùng","Sách, ấn bản & sản phẩm văn hóa","HNX",18,16.2,"2021-03-05","2021-02-05",1.9,1.5,3.4,16.1,"2021-02-08",17.35,17.39,19.5,"2021-03-03",false,18
"DAG","Công ty Cổ phần Tập đoàn Nhựa Đông Á","Nguyên vật liệu","Nhựa, cao su & sợi","HOSE",6.76,6.27,"2021-03-05","2021-02-05",6.76,0.04,6.8,0,"2021-02-15",6.51,5.82,6.8,"2021-02-19",false,18
"DAH","Công ty Cổ phần Tập đoàn Khách sạn Đông Á","Dịch vụ Tiêu dùng","Khách sạn","HOSE",4.36,3.81,"2021-03-05","2021-02-05",4.36,0.04,4.4,0,"2021-02-15",4.03,3.62,4.4,"2021-03-03",false,18
"DAT","Công ty cổ phần Đầu tư Du lịch và Phát triển Thủy sản","Hàng Tiêu dùng","Nuôi trồng nông & hải sản","HOSE",28.4,27.7,"2021-03-05","2021-02-05",28.4,0.55,28.95,0,"2021-02-15",27.9,24.7,28.95,"2021-02-19",false,17
"DBC","Công ty Cổ phần Tập đoàn Dabaco Việt Nam","Hàng Tiêu dùng","Nuôi trồng nông & hải sản","HOSE",54.9,51.9,"2021-03-05","2021-02-05",54.9,0.6,55.5,0,"2021-02-15",52.2,46.68,55.5,"2021-03-04",false,18
"DBD","Công ty Cổ phần Dược - Trang thiết bị y tế Bình Định","Dược phẩm và Y tế","Dược phẩm","HOSE",49,47.9,"2021-03-05","2021-02-05",49,0.25,49.25,0,"2021-02-15",48.55,43.09,49.25,"2021-03-03",false,18
"DBT","Công ty Cổ phần Dược phẩm Bến Tre","Dược phẩm và Y tế","Dược phẩm","HOSE",12.4,12.71,"2021-03-05","2021-02-05",12.4,1.05,13.45,0,"2021-02-15",13,11.49,13.45,"2021-02-19",false,18
"DC2","Công ty Cổ phần Đầu tư Phát triển - Xây dựng (DIC) số 2","Công nghiệp","Xây dựng","HNX",13.6,11.5,"2021-03-05","2021-02-05",2.8,0,2.8,10.8,"2021-02-09",12.15,12.07,13.6,"2021-03-05",false,18
"DC4","Công ty Cổ phần Xây dựng DIC Holdings","Công nghiệp","Xây dựng","HOSE",11.5,10.7,"2021-03-05","2021-02-05",11.5,0,11.5,0,"2021-02-15",10.75,9.64,11.5,"2021-03-05",false,18
"DCL","Công ty Cổ phần Dược phẩm Cửu Long","Dược phẩm và Y tế","Dược phẩm","HOSE",29,26.5,"2021-03-05","2021-02-05",29,0,29,0,"2021-02-15",27.9,24.89,29,"2021-03-05",false,18
"DCM","Công ty Cổ phần Phân bón Dầu Khí Cà Mau","Nguyên vật liệu","Sản phẩm hóa dầu, Nông dược & Hóa chất khác","HOSE",16.8,12.9,"2021-03-05","2021-02-05",16.8,0,16.8,0,"2021-02-15",13.57,12.45,16.8,"2021-03-05",false,18
"DDG","Công ty Cổ phần Đầu tư Công nghiệp Xuất nhập khẩu Đông Dương","Tiện ích Cộng đồng","Phân phối xăng dầu & khí đốt","HNX30",31,31.7,"2021-03-05","2021-02-05",0,1.1,1.1,31,"2021-03-04",31.4,31.48,32.1,"2021-02-17",true,18
"DGC","Công ty Cổ phần Tập đoàn Hóa chất Đức Giang","Nguyên vật liệu","Sản phẩm hóa dầu, Nông dược & Hóa chất khác","HOSE",71.4,54.1,"2021-03-05","2021-02-05",71.4,0,71.4,0,"2021-02-15",59.6,55.13,71.4,"2021-03-05",false,18
"DGW","Công ty Cổ phần Thế Giới Số","Dịch vụ Tiêu dùng","Phân phối hàng chuyên dụng","HOSE",111.2,82.9,"2021-03-05","2021-02-05",111.2,0,111.2,0,"2021-02-15",83.9,84.19,111.2,"2021-03-05",false,18
"DHA","Công ty Cổ phần Hóa An","Công nghiệp","Vật liệu xây dựng & Nội thất","HOSE",51.9,48,"2021-03-05","2021-02-05",51.9,0,51.9,0,"2021-02-15",50.05,44.47,51.9,"2021-03-05",false,18
"DHC","Công ty Cổ phần Đông Hải Bến Tre","Nguyên vật liệu","Sản xuất giấy","HOSE",79.8,68,"2021-03-05","2021-02-05",79.8,0,79.8,0,"2021-02-15",73.05,65.67,79.8,"2021-03-05",false,18
"DHG","Công ty Cổ phần Dược Hậu Giang","Dược phẩm và Y tế","Dược phẩm","HOSE",99,100.8,"2021-03-05","2021-02-05",99,2.9,101.9,0,"2021-02-15",100.65,89.32,101.9,"2021-02-23",false,18
"DHM","Công ty Cổ phần Thương mại & Khai thác Khoáng sản Dương Hiếu","Nguyên vật liệu","Khai khoáng ","HOSE",9.96,10,"2021-03-05","2021-02-05",9.96,0.29,10.25,0,"2021-02-15",9.95,8.91,10.25,"2021-03-03",false,18
"DHP","Công ty Cổ phần Điện cơ Hải Phòng","Công nghiệp","Thiết bị điện","HNX",10,9.6,"2021-03-03","2021-02-05",0.4,0,0.4,9.6,"2021-02-05",9.7,9.82,10,"2021-02-25",false,8
"DHT","Công ty Cổ phần Dược phẩm Hà Tây","Dược phẩm và Y tế","Dược phẩm","HNX30",52.9,53.3,"2021-03-05","2021-02-05",0.4,0.7,1.1,52.5,"2021-02-08",53.25,53.26,53.6,"2021-02-17",true,18
"DIG","Tổng Công ty Cổ phần Đầu tư Phát triển Xây dựng","Tài chính","Bất động sản","HOSE",30.5,29.6,"2021-03-05","2021-02-05",30.5,2.25,32.75,0,"2021-02-15",30.92,27.55,32.75,"2021-02-26",false,18
"DIH","Công ty Cổ phần Đầu tư Phát triển Xây dựng - Hội An","Công nghiệp","Xây dựng","HNX",13.2,15.5,"2021-03-05","2021-02-08",1.2,2.7,3.9,12,"2021-02-26",13.15,13.91,15.9,"2021-02-09",true,12
"DL1","Công ty Cổ phần Tập đoàn Năng lượng Tái tạo Việt Nam","Công nghiệp","Kho bãi, hậu cần và bảo dưỡng","HNX",18,22.5,"2021-02-23","2021-02-08",1,4.5,5.5,17,"2021-02-22",18.3,19.22,22.5,"2021-02-08",true,5
"DLG","Công ty Cổ phần Tập đoàn Đức Long Gia Lai","Nguyên vật liệu","Lâm sản và Chế biến gỗ","HOSE",1.84,1.57,"2021-03-05","2021-02-05",1.84,0.01,1.85,0,"2021-02-15",1.81,1.57,1.85,"2021-03-03",false,18
"DMC","Công ty Cổ phần Xuất nhập khẩu Y tế DOMESCO","Dược phẩm và Y tế","Dược phẩm","HOSE",54.2,54.6,"2021-03-05","2021-02-05",54.2,2.5,56.7,0,"2021-02-15",55.4,49.14,56.7,"2021-02-19",false,18
"DNC","Công ty Cổ phần Điện nước Lắp máy Hải Phòng","Tiện ích Cộng đồng","Sản xuất & Phân phối Điện","HNX",45,46.2,"2021-03-05","2021-02-22",0,5,5,45,"2021-03-05",50,48.24,50,"2021-02-24",true,5
"DNM","Tổng Công ty Cổ phần Y tế Danameco","Dược phẩm và Y tế","Dụng cụ y tế","HNX",38,41.5,"2021-03-05","2021-02-05",0.3,7.6,7.9,37.7,"2021-03-04",40.9,40.75,45.6,"2021-02-08",true,18
"DNP","Công ty Cổ phần Nhựa Đồng Nai","Công nghiệp","Vật liệu xây dựng & Nội thất","HNX",24.3,18,"2021-03-05","2021-02-05",6.3,0,6.3,18,"2021-02-05",19.5,20.01,24.3,"2021-03-05",false,18
"DP3","Công ty Cổ Phần Dược Phẩm Trung Ương 3","Dược phẩm và Y tế","Dược phẩm","HNX30",114.2,99,"2021-03-05","2021-02-05",15.2,0.8,16,99,"2021-02-05",113.1,106.55,115,"2021-03-02",false,18
"DPC","Công ty Cổ phần Nhựa Đà Nẵng","Công nghiệp","Containers & Đóng gói","HNX",16.2,15,"2021-03-01","2021-02-17",1.2,1.8,3,15,"2021-02-17",16.35,16.43,18,"2021-02-23",true,4
"DPG","Công ty Cổ phần Đạt Phương","Công nghiệp","Xây dựng","HOSE",29.5,26.5,"2021-03-05","2021-02-05",29.5,1.05,30.55,0,"2021-02-15",28.6,25.34,30.55,"2021-03-03",false,18
"DPM","Tổng Công ty Cổ phần Phân bón và Hóa chất Dầu khí","Nguyên vật liệu","Sản phẩm hóa dầu, Nông dược & Hóa chất khác","HOSE",19.2,16.3,"2021-03-05","2021-02-05",19.2,0,19.2,0,"2021-02-15",17.07,15.38,19.2,"2021-03-05",false,18
"DPR","Công ty Cổ phần Cao su Đồng Phú","Nguyên vật liệu","Nhựa, cao su & sợi","HOSE",49.3,47.45,"2021-03-05","2021-02-05",49.3,0,49.3,0,"2021-02-15",48.25,42.85,49.3,"2021-03-05",false,18
"DQC","Công ty Cổ phần Bóng đèn Điện Quang","Hàng Tiêu dùng","Thiết bị gia dụng","HOSE",24.9,17.8,"2021-03-05","2021-02-05",24.9,0,24.9,0,"2021-02-15",18.5,17.39,24.9,"2021-03-05",false,18
"DRC","Công ty Cổ phần Cao su Đà Nẵng","Hàng Tiêu dùng","Lốp xe","HOSE",26.9,27.5,"2021-03-05","2021-02-05",26.9,1.75,28.65,0,"2021-02-15",27.8,24.73,28.65,"2021-02-18",false,18
"DRH","Công ty Cổ phần DRH Holdings","Tài chính","Bất động sản","HOSE",10.1,9.75,"2021-03-05","2021-02-05",10.1,0.85,10.95,0,"2021-02-15",10.47,9.12,10.95,"2021-02-23",false,18
"DRL","Công ty Cổ phần Thủy điện - Điện lực 3","Tiện ích Cộng đồng","Sản xuất & Phân phối Điện","HOSE",57,54.4,"2021-03-05","2021-02-05",57,0,57,0,"2021-02-15",56.4,49.41,57,"2021-02-19",false,17
"DS3","Công ty Cổ phần Quản lý Đường sông số 3","Công nghiệp","Kho bãi, hậu cần và bảo dưỡng","HNX",6.4,5,"2021-03-05","2021-02-05",1.5,0,1.5,4.9,"2021-02-08",5.05,5.41,6.4,"2021-03-03",false,18
"DSN","Công ty Cổ phần Công viên nước Đầm Sen","Dịch vụ Tiêu dùng","Dịch vụ giải trí","HOSE",47.5,47.3,"2021-03-05","2021-02-05",47.5,1.5,49,0,"2021-02-15",47.67,42.43,49,"2021-02-26",false,18
"DST","Công ty Cổ phần Đầu tư Sao Thăng Long","Dịch vụ Tiêu dùng","Sách, ấn bản & sản phẩm văn hóa","HNX",3.6,3,"2021-03-05","2021-02-05",0.8,0,0.8,2.8,"2021-02-08",3.1,3.17,3.6,"2021-03-03",false,18
"DTA","Công ty Cổ phần Đệ Tam","Tài chính","Bất động sản","HOSE",8.46,6.1,"2021-03-05","2021-02-05",8.46,0,8.46,0,"2021-02-15",6.67,6.12,8.46,"2021-03-05",false,18
"DTD","Công ty Cổ phần Đầu tư Phát triển Thành Đạt","Công nghiệp","Xây dựng","HNX30",29,25.5,"2021-03-05","2021-02-05",3.5,0.5,4,25.5,"2021-02-05",28.15,27.92,29.5,"2021-02-19",false,18
"DTK","Tổng Công ty Điện lực TKV - Công ty Cổ phần","Công nghiệp","Xây dựng","HNX",12,12.3,"2021-03-05","2021-02-05",0.4,0.5,0.9,11.6,"2021-02-19",11.95,12.02,12.5,"2021-02-18",true,18
"DTT","Công ty Cổ phần Kỹ nghệ Đô Thành","Nguyên vật liệu","Nhựa, cao su & sợi","HOSE",14,12.5,"2021-03-05","2021-02-25",1.5,0.25,1.75,12.5,"2021-02-25",13.35,13.32,14.25,"2021-03-04",false,5
"DVG","Công ty Cổ phần Tập đoàn Sơn Đại Việt","Công nghiệp","Vật liệu xây dựng & Nội thất","HNX",14.9,15.8,"2021-03-05","2021-02-05",1.4,1.1,2.5,13.5,"2021-02-24",15.5,15.26,16,"2021-03-01",true,17
"DVP","Công ty Cổ phần Đầu tư và Phát triển Cảng Đình Vũ","Công nghiệp","Kho bãi, hậu cần và bảo dưỡng","HOSE",47,43.8,"2021-03-05","2021-02-05",47,0.55,47.55,0,"2021-02-15",45.55,40.61,47.55,"2021-03-03",false,18
"DXG","Công ty Cổ phần Tập đoàn Đất Xanh","Tài chính","Bất động sản","HOSE",22.25,22.5,"2021-03-05","2021-02-05",22.25,2.65,24.9,0,"2021-02-15",23.2,20.83,24.9,"2021-02-22",false,18
"DXP","Công ty Cổ phần Cảng Đoạn Xá","Công nghiệp","Kho bãi, hậu cần và bảo dưỡng","HNX",17,15.3,"2021-03-05","2021-02-05",2.3,0.5,2.8,14.7,"2021-02-08",16.4,16.13,17.5,"2021-03-02",false,18
"DXV","Công ty Cổ phần VICEM Vật liệu Xây dựng Đà Nẵng","Công nghiệp","Vật liệu xây dựng & Nội thất","HOSE",4.35,4.21,"2021-03-05","2021-02-05",4.35,0.16,4.51,0,"2021-02-15",4.31,3.82,4.51,"2021-03-04",false,18
"DZM","Công ty Cổ phần Cơ điện Dzĩ An","Công nghiệp","Máy công nghiệp","HNX",5,4.6,"2021-03-05","2021-02-05",0.4,0,0.4,4.6,"2021-02-05",4.6,4.67,5,"2021-03-05",false,18
"EBA","Công ty Cổ phần Điện Bắc Nà","Tiện ích Cộng đồng","Sản xuất & Phân phối Điện","HNX",9.6,9.6,"2021-02-19","2021-02-19",0,0,0,9.6,"2021-02-19",9.6,9.6,9.6,"2021-02-19",false,1
"EBS","Công ty Cổ phần Sách Giáo dục tại Thành phố Hà Nội","Dịch vụ Tiêu dùng","Sách, ấn bản & sản phẩm văn hóa","HNX",9.8,10.1,"2021-03-05","2021-02-05",0.3,0.3,0.6,9.5,"2021-02-08",9.7,9.72,10.1,"2021-02-05",false,18
"EIB","Ngân hàng Thương mại Cổ phần Xuất nhập khẩu Việt Nam","Ngân hàng","Ngân hàng","VN30",18.5,17.9,"2021-03-05","2021-02-05",18.5,0.3,18.8,0,"2021-02-15",18.25,16.25,18.8,"2021-03-02",false,18
"EID","Công ty Cổ phần Đầu tư và Phát triển Giáo dục Hà Nội","Dịch vụ Tiêu dùng","Sách, ấn bản & sản phẩm văn hóa","HNX",15.9,16.2,"2021-03-05","2021-02-05",0.37,1.3,1.67,15.53,"2021-02-19",16.05,16.21,17.2,"2021-02-26",true,18
"ELC","Công ty Cổ phần Đầu tư Phát triển Công nghệ điện tử - Viễn thông","Công nghệ Thông tin","Thiết bị viễn thông","HOSE",10.45,9.62,"2021-03-05","2021-02-05",10.45,0.9,11.35,0,"2021-02-15",11,9.59,11.35,"2021-03-01",false,18
"EMC","Công ty Cổ phần Cơ điện Thủ Đức","Công nghiệp","Thiết bị điện","HOSE",17.15,15.05,"2021-03-05","2021-02-25",2.1,0,2.1,15.05,"2021-02-25",16.05,16.08,17.15,"2021-03-05",false,3
"EVE","Công ty Cổ phần Everpia","Hàng Tiêu dùng","Hàng May mặc","HOSE",13.2,13.35,"2021-03-05","2021-02-05",13.2,0.4,13.6,0,"2021-02-15",13.27,11.79,13.6,"2021-02-23",false,18
"EVG","Công ty Cổ phần Tập đoàn Everland","Công nghiệp","Xây dựng","HOSE",9.74,9.41,"2021-03-05","2021-02-05",9.74,0.31,10.05,0,"2021-02-15",9.29,8.4,10.05,"2021-02-17",false,18
"EVS","Công ty Cổ phần Chứng khoán Everest","Tài chính","Môi giới chứng khoán","HNX",12.9,9.3,"2021-03-05","2021-02-05",3.7,0.3,4,9.2,"2021-02-08",9.25,10.63,13.2,"2021-03-02",false,18
"FCM","Công ty Cổ phần Khoáng sản FECON","Công nghiệp","Vật liệu xây dựng & Nội thất","HOSE",6.6,6.3,"2021-03-05","2021-02-05",6.6,0.24,6.84,0,"2021-02-15",6.53,5.8,6.84,"2021-02-25",false,18
"FCN","Công ty Cổ phần FECON","Công nghiệp","Xây dựng","HOSE",13.45,11.65,"2021-03-05","2021-02-05",13.45,0.15,13.6,0,"2021-02-15",12.23,11.03,13.6,"2021-03-03",false,18
"FDC","Công ty Cổ phần Ngoại thương và Phát triển Đầu tư Thành phố Hồ Chí Minh","Tài chính","Bất động sản","HOSE",12.25,11.9,"2021-03-05","2021-02-05",12.25,0.3,12.55,0,"2021-02-15",11.93,10.69,12.55,"2021-02-17",false,18
"FID","Công ty Cổ phần Đầu tư và Phát triển Doanh nghiệp Việt Nam","Tài chính","Tư Vấn, Định giá, Môi giới Bất động sản","HNX",2.6,1.8,"2021-03-05","2021-02-05",0.8,0,0.8,1.8,"2021-02-05",1.9,1.98,2.6,"2021-03-05",false,18
"FIR","Công ty Cổ phần Địa ốc First Real","Tài chính","Bất động sản","HOSE",25.65,25.6,"2021-03-05","2021-02-05",25.65,1,26.65,0,"2021-02-15",26.08,23.11,26.65,"2021-03-03",false,18
"FIT","Công ty Cổ phần Tập đoàn F.I.T","Tài chính","Tài chính đặc biệt","HOSE",10.75,12.2,"2021-03-05","2021-02-05",10.75,1.45,12.2,0,"2021-02-15",10.95,9.92,12.2,"2021-02-05",false,18
"FLC","Công ty Cổ phần Tập đoàn FLC","Tài chính","Bất động sản","HOSE",6.3,6.52,"2021-03-05","2021-02-05",6.3,0.4,6.7,0,"2021-02-15",6.29,5.61,6.7,"2021-02-17",false,18
"FMC","Công ty Cổ phần Thực phẩm Sao Ta","Hàng Tiêu dùng","Nuôi trồng nông & hải sản","HOSE",33.3,30.6,"2021-03-05","2021-02-05",33.3,0.9,34.2,0,"2021-02-15",32.6,28.77,34.2,"2021-03-03",false,18
"FPT","Công ty Cổ phần FPT","Công nghệ Thông tin","Phần mềm","VN30",75.9,72.9,"2021-03-05","2021-02-05",75.9,2.3,78.2,0,"2021-02-15",76.05,67.61,78.2,"2021-02-18",false,18
"FRT","Công ty Cổ phần Bán lẻ Kỹ thuật số FPT","Dịch vụ Tiêu dùng","Phân phối hàng chuyên dụng","HOSE",27.7,27,"2021-03-05","2021-02-05",27.7,1.65,29.35,0,"2021-02-15",28.02,24.94,29.35,"2021-02-22",false,18
"FTM","Công ty Cổ phần Đầu tư và Phát triển Đức Quân","Hàng Tiêu dùng","Hàng May mặc","HOSE",1.82,1.68,"2021-03-05","2021-02-05",1.82,0.04,1.86,0,"2021-02-15",1.81,1.59,1.86,"2021-02-18",false,18
"FTS","Công ty Cổ phần Chứng khoán FPT","Tài chính","Môi giới chứng khoán","HOSE",16.6,16.35,"2021-03-05","2021-02-05",16.6,0.6,17.2,0,"2021-02-15",16.6,14.78,17.2,"2021-03-01",false,18
"GAB","Công ty Cổ phần Đầu tư Khai khoáng & Quản lý Tài sản FLC","Công nghiệp","Vật liệu xây dựng & Nội thất","HOSE",195.3,194.4,"2021-03-05","2021-02-05",195.3,0.5,195.8,0,"2021-02-15",195.05,173.32,195.8,"2021-03-02",false,18
"GAS","Tổng Công ty Khí Việt Nam - Công ty Cổ phần","Tiện ích Cộng đồng","Phân phối xăng dầu & khí đốt","VN30",92.5,81.2,"2021-03-05","2021-02-05",92.5,0,92.5,0,"2021-02-15",89.05,78.27,92.5,"2021-03-05",false,18
"GDT","Công ty Cổ phần Chế biến Gỗ Đức Thành","Hàng Tiêu dùng","Thiết bị gia dụng","HOSE",43,38.9,"2021-03-05","2021-02-05",43,2.2,45.2,0,"2021-02-15",42.4,37.43,45.2,"2021-02-23",false,18
"GDW","Công ty Cổ phần Cấp nước Gia Định","Tiện ích Cộng đồng","Nước","HNX",26.9,26.6,"2021-03-04","2021-02-08",0.3,3,3.3,26.6,"2021-02-08",27.4,27.92,29.9,"2021-02-18",true,10
"GEG","Công ty Cổ phần Điện Gia Lai","Tiện ích Cộng đồng","Sản xuất & Phân phối Điện","HOSE",17.4,17.7,"2021-03-05","2021-02-05",17.4,0.7,18.1,0,"2021-02-15",17.5,15.56,18.1,"2021-02-17",false,18
"GEX","Tổng Công ty Cổ phần Thiết bị điện Việt Nam","Công nghiệp","Thiết bị điện","HOSE",22.95,20.95,"2021-03-05","2021-02-05",22.95,0,22.95,0,"2021-02-15",21.35,19.24,22.95,"2021-03-04",false,18
"GIC","Công ty Cổ phần Đầu tư Dịch vụ và Phát triển Xanh","Công nghiệp","Kho bãi, hậu cần và bảo dưỡng","HNX",23,22.4,"2021-03-05","2021-02-05",0.6,1.1,1.7,22.4,"2021-02-05",23.5,23.32,24.1,"2021-03-01",true,18
"GIL","Công ty Cổ phần Sản xuất Kinh doanh Xuất nhập khẩu Bình Thạnh","Hàng Tiêu dùng","Hàng May mặc","HOSE",65.5,53.9,"2021-03-05","2021-02-05",65.5,4,69.5,0,"2021-02-15",61.1,55.93,69.5,"2021-02-26",false,18
"GKM","Công ty Cổ phần Khang Minh Group","Công nghiệp","Vật liệu xây dựng & Nội thất","HNX",16,18.8,"2021-03-05","2021-02-05",0.1,3.1,3.2,15.9,"2021-03-04",16.85,17.48,19.1,"2021-02-09",true,18
"GLT","Công ty Cổ phần Kỹ thuật điện Toàn Cầu","Hàng Tiêu dùng","Điện tử tiêu dùng","HNX",20.6,19.6,"2021-03-05","2021-02-05",1.1,0.4,1.5,19.5,"2021-02-08",20.1,20.14,21,"2021-03-02",false,18
"GMA","Công ty Cổ phần Enteco Việt Nam","Công nghiệp","Máy công nghiệp","HNX",39.8,38.5,"2021-03-04","2021-02-05",1.3,0,1.3,38.5,"2021-02-05",39.05,39.13,39.8,"2021-03-04",false,16
"GMC","Công ty Cổ phần Garmex Sài Gòn","Hàng Tiêu dùng","Hàng May mặc","HOSE",37,27.4,"2021-03-05","2021-02-05",37,2.25,39.25,0,"2021-02-15",32.88,30.1,39.25,"2021-03-02",false,18
"GMD","Công ty Cổ phần Gemadept","Công nghiệp","Kho bãi, hậu cần và bảo dưỡng","HOSE",32.7,31,"2021-03-05","2021-02-05",32.7,1.65,34.35,0,"2021-02-15",32.85,29.05,34.35,"2021-03-01",false,18
"GMX","Công ty Cổ phần Gạch ngói Gốm xây dựng Mỹ Xuân","Công nghiệp","Vật liệu xây dựng & Nội thất","HNX",25.6,25,"2021-03-05","2021-02-05",2.3,0.4,2.7,23.3,"2021-02-25",25.05,25.16,26,"2021-03-03",false,14
"GSP","Công ty Cổ phần Vận tải Sản phẩm Khí Quốc tế","Công nghiệp","Vận tải Thủy","HOSE",12.8,11.8,"2021-03-05","2021-02-05",12.8,0,12.8,0,"2021-02-15",12.22,10.9,12.8,"2021-03-05",false,18
"GTA","Công ty Cổ phần Chế biến Gỗ Thuận An","Nguyên vật liệu","Lâm sản và Chế biến gỗ","HOSE",14.2,13.5,"2021-03-05","2021-02-05",14.2,0,14.2,0,"2021-02-15",13.25,11.89,14.2,"2021-03-04",false,17
"GTN","Công ty Cổ phần GTNFOODS","Hàng Tiêu dùng","Nuôi trồng nông & hải sản","HOSE",25.8,23.8,"2021-03-05","2021-02-05",25.8,1.55,27.35,0,"2021-02-15",25.17,22.45,27.35,"2021-03-02",false,18
"GVR","Tập đoàn Công nghiệp Cao su Việt Nam","Nguyên vật liệu","Nhựa, cao su & sợi","HOSE",29.05,25.7,"2021-03-05","2021-02-05",29.05,0.85,29.9,0,"2021-02-15",28.43,24.79,29.9,"2021-02-23",false,18
"HAD","Công ty Cổ phần Bia Hà Nội - Hải Dương","Hàng Tiêu dùng","Sản xuất bia ","HNX",19.5,18.7,"2021-03-05","2021-02-05",0.8,0.6,1.4,18.7,"2021-02-05",19.45,19.4,20.1,"2021-03-01",false,16
"HAG","Công ty Cổ phần Hoàng Anh Gia Lai","Hàng Tiêu dùng","Nuôi trồng nông & hải sản","HOSE",4.84,4.56,"2021-03-05","2021-02-05",4.84,0.01,4.85,0,"2021-02-15",4.7,4.18,4.85,"2021-02-18",false,18
"HAH","Công ty Cổ phần Vận tải và Xếp dỡ Hải An","Công nghiệp","Kho bãi, hậu cần và bảo dưỡng","HOSE",25.3,17.8,"2021-03-05","2021-02-05",25.3,0.3,25.6,0,"2021-02-15",19.25,18.36,25.6,"2021-03-03",false,18
"HAI","Công ty Cổ phần Nông dược HAI","Nguyên vật liệu","Sản phẩm hóa dầu, Nông dược & Hóa chất khác","HOSE",3.17,3,"2021-03-05","2021-02-05",3.17,0.11,3.28,0,"2021-02-15",3.11,2.76,3.28,"2021-02-23",false,18
"HAP","Công ty Cổ phần Tập Đoàn Hapaco","Nguyên vật liệu","Sản xuất giấy","HOSE",8.66,6.11,"2021-03-05","2021-02-05",8.66,0,8.66,0,"2021-02-15",6.8,6.19,8.66,"2021-03-05",false,18
"HAR","Công ty Cổ phần Đầu tư Thương mại Bất động sản An Dương Thảo Điền","Tài chính","Bất động sản","HOSE",5.11,4.9,"2021-03-05","2021-02-05",5.11,0.26,5.37,0,"2021-02-15",5.13,4.54,5.37,"2021-03-03",false,18
"HAS","Công ty Cổ phần Hacisco","Công nghiệp","Xây dựng","HOSE",9.9,9.75,"2021-03-05","2021-02-05",9.9,0.35,10.25,0,"2021-02-15",9.65,8.64,10.25,"2021-02-22",false,18
"HAT","Công ty Cổ phần Thương mại Bia Hà Nội","Hàng Tiêu dùng","Sản xuất bia ","HNX",21.5,21.7,"2021-03-05","2021-02-05",0.5,1.2,1.7,21,"2021-02-09",21.8,21.76,22.7,"2021-02-17",true,17
"HAX","Công ty Cổ phần Dịch vụ Ô tô Hàng Xanh","Hàng Tiêu dùng","Sản xuất ô tô","HOSE",21.7,19,"2021-03-05","2021-02-05",21.7,0.3,22,0,"2021-02-15",19.93,17.97,22,"2021-03-03",false,18
"HBC","Công ty Cổ phần Tập đoàn Xây dựng Hòa Bình","Công nghiệp","Xây dựng","HOSE",17.95,16.15,"2021-03-05","2021-02-05",17.95,0.8,18.75,0,"2021-02-15",17.33,15.39,18.75,"2021-03-03",false,18
"HBE","Công ty Cổ phần Sách - Thiết bị trường học Hà Tĩnh","Dịch vụ Tiêu dùng","Sách, ấn bản & sản phẩm văn hóa","HNX",7.5,8,"2021-03-05","2021-02-09",0,1.3,1.3,7.5,"2021-02-22",8,7.95,8.8,"2021-02-17",true,15
"HBS","Công ty Cổ phần Chứng khoán Hòa Bình","Tài chính","Môi giới chứng khoán","HNX",6.1,4.8,"2021-03-05","2021-02-05",1.7,0.1,1.8,4.4,"2021-02-08",4.8,5,6.2,"2021-03-04",false,18
"HCC","Công ty Cổ phần Bê tông Hòa Cầm - Intimex","Công nghiệp","Vật liệu xây dựng & Nội thất","HNX",10,9.9,"2021-03-05","2021-02-05",0.2,0.1,0.3,9.8,"2021-02-08",9.95,9.93,10.1,"2021-03-04",false,18
"HCD","Công ty Cổ phần Đầu tư Sản xuất và Thương mại HCD","Nguyên vật liệu","Nhựa, cao su & sợi","HOSE",2.91,2.53,"2021-03-05","2021-02-05",2.91,0.07,2.98,0,"2021-02-15",2.63,2.4,2.98,"2021-03-03",false,18
"HCM","Công ty Cổ phần Chứng khoán Thành phố Hồ Chí Minh","Tài chính","Môi giới chứng khoán","HOSE",31,28,"2021-03-05","2021-02-05",31,0.15,31.15,0,"2021-02-15",29.25,26.24,31.15,"2021-03-03",false,18
"HCT","Công ty Cổ phần Thương mại - Dịch vụ - Vận tải Xi măng Hải Phòng","Công nghiệp","Dịch vụ vận tải","HNX",16,16,"2021-03-02","2021-02-09",2.7,0.1,2.8,13.3,"2021-02-25",16,15.15,16.1,"2021-02-17",false,11
"HDA","Công ty Cổ phần Hãng sơn Đông Á","Công nghiệp","Vật liệu xây dựng & Nội thất","HNX",9.6,9,"2021-03-05","2021-02-05",0.6,0.1,0.7,9,"2021-02-05",9.55,9.46,9.7,"2021-02-17",false,18
"HDB","Ngân hàng Thương mại Cổ phần Phát Triển Thành phố Hồ Chí Minh","Ngân hàng","Ngân hàng","VN30",25.85,24.1,"2021-03-05","2021-02-05",25.85,1.1,26.95,0,"2021-02-15",25.5,22.64,26.95,"2021-03-03",false,18
"HDC","Công ty Cổ phần Phát triển Nhà Bà Rịa Vũng Tàu","Tài chính","Bất động sản","HOSE",43.15,39.9,"2021-03-05","2021-02-05",43.15,1.15,44.3,0,"2021-02-15",42.15,37.4,44.3,"2021-02-18",false,18
"HDG","Công ty Cổ phần Tập đoàn Hà Đô","Tài chính","Bất động sản","HOSE",43.9,40.3,"2021-03-05","2021-02-05",43.9,0.5,44.4,0,"2021-02-15",41.55,37.11,44.4,"2021-03-04",false,18
"HEV","Công ty Cổ phần Sách Đại học - Dạy nghề","Dịch vụ Tiêu dùng","Sách, ấn bản & sản phẩm văn hóa","HNX",14.8,14.8,"2021-03-03","2021-02-17",1.4,0,1.4,13.4,"2021-02-26",14.15,14.13,14.8,"2021-02-17",false,6
"HHC","Công ty Cổ phần Bánh kẹo Hải Hà","Hàng Tiêu dùng","Thực phẩm","HNX",99.9,76.3,"2021-02-19","2021-02-05",23.6,0,23.6,76.3,"2021-02-05",92.2,89.45,99.9,"2021-02-19",false,6
"HHG","Công ty Cổ phần Hoàng Hà","Dịch vụ Tiêu dùng","Vận tải hành khách & Du lịch","HNX",2.3,1.8,"2021-03-05","2021-02-05",0.6,0,0.6,1.7,"2021-02-08",1.85,1.95,2.3,"2021-03-04",false,18
"HHP","Công ty Cổ phần Giấy Hoàng Hà Hải Phòng","Nguyên vật liệu","Sản xuất giấy","HNX",15.95,13.2,"2021-03-05","2021-02-05",2.85,0,2.85,13.1,"2021-02-08",13.8,14.22,15.95,"2021-03-05",false,10
"HHS","Công ty Cổ phần Đầu tư Dịch vụ Hoàng Huy","Hàng Tiêu dùng","Sản xuất ô tô","HOSE",6.46,5.75,"2021-03-05","2021-02-05",6.46,0,6.46,0,"2021-02-15",6.1,5.39,6.46,"2021-03-05",false,18
"HID","Công ty Cổ phần Halcom Vietnam","Công nghiệp","Xây dựng","HOSE",3.53,3.77,"2021-03-05","2021-02-05",3.53,0.27,3.8,0,"2021-02-15",3.55,3.2,3.8,"2021-02-09",false,18
"HII","Công ty Cổ phần An Tiến Industries","Nguyên vật liệu","Nhựa, cao su & sợi","HOSE",21.05,23.3,"2021-03-05","2021-02-05",21.05,2.7,23.75,0,"2021-02-15",21.65,19.6,23.75,"2021-02-09",false,18
"HJS","Công ty Cổ phần Thủy điện Nậm Mu","Tiện ích Cộng đồng","Sản xuất & Phân phối Điện","HNX",34.5,36.4,"2021-03-05","2021-02-19",0.4,1.9,2.3,34.1,"2021-02-22",34.5,34.64,36.4,"2021-02-19",true,7
"HKT","Công ty Cổ phần Đầu tư Ego Việt Nam","Hàng Tiêu dùng","Đồ uống & giải khát","HNX",8.4,10,"2021-03-05","2021-02-17",0.5,1.6,2.1,7.9,"2021-03-02",8.4,8.98,10,"2021-02-17",true,10
